{
  "$schema": "../../schema-json/scenario.schema.json",
  "id": "scenario.default_freighter_run",
  "name": "Freighter Run",
  "deckId": "deck.freighter_mk2",
  "startPortId": "port.crossroads_hub",
  "crew": [
    "crew.mara_osei",
    "crew.dane_whitcross",
    "crew.priya_kessler",
    "crew.tomas_ruiz",
    "crew.jax_okonkwo",
    "crew.bettina_solheim",
    "crew.oyelaran_abiodun",
    "crew.sunniva_park",
    "crew.noor_haddad"
  ],
  "startingMoney": 5000,
  "startingItems": [
    {
      "itemDefId": "item.toolkit",
      "count": 2,
      "zoneKey": "cargo_stow"
    },
    {
      "itemDefId": "item.welder_torch",
      "count": 1,
      "zoneKey": "cargo_stow"
    },
    {
      "itemDefId": "item.welder_torch",
      "count": 1,
      "zoneKey": "parts"
    },
    {
      "itemDefId": "item.spare_parts_stack",
      "count": 10,
      "zoneKey": "cargo_stow"
    },
    {
      "itemDefId": "item.ration_pack",
      "count": 60,
      "zoneKey": "cargo_stow"
    },
    {
      "itemDefId": "item.coolant_canister",
      "count": 4,
      "zoneKey": "cargo_stow"
    },
    {
      "itemDefId": "item.med_kit",
      "count": 3,
      "zoneKey": "cargo_stow"
    },
    {
      "itemDefId": "item.hand_truck",
      "count": 1,
      "zoneKey": "cargo_stow"
    },
    {
      "itemDefId": "item.provisions",
      "count": 18,
      "zoneKey": "pantry"
    },
    {
      "itemDefId": "item.mop",
      "count": 1,
      "zoneKey": "cleaning_locker"
    },
    {
      "itemDefId": "item.book",
      "count": 3,
      "zoneKey": "book_shelf"
    },
    {
      "itemDefId": "item.patch_kit",
      "count": 2,
      "zoneKey": "locker_bunk_1"
    },
    {
      "itemDefId": "item.patch_kit",
      "count": 2,
      "zoneKey": "locker_bunk_2"
    },
    {
      "itemDefId": "item.patch_kit",
      "count": 2,
      "zoneKey": "locker_bunk_3"
    },
    {
      "itemDefId": "item.patch_kit",
      "count": 2,
      "zoneKey": "locker_bunk_4"
    },
    {
      "itemDefId": "item.patch_kit",
      "count": 2,
      "zoneKey": "locker_bunk_5"
    },
    {
      "itemDefId": "item.patch_kit",
      "count": 2,
      "zoneKey": "locker_bunk_6"
    },
    {
      "itemDefId": "item.patch_kit",
      "count": 2,
      "zoneKey": "locker_bunk_7"
    },
    {
      "itemDefId": "item.patch_kit",
      "count": 2,
      "zoneKey": "locker_bunk_8"
    },
    {
      "itemDefId": "item.patch_kit",
      "count": 2,
      "zoneKey": "locker_captain"
    },
    {
      "itemDefId": "item.patch_kit",
      "count": 2,
      "zoneKey": "locker_first_officer"
    },
    {
      "itemDefId": "item.patch_kit",
      "count": 2,
      "zoneKey": "locker_passenger_1"
    },
    {
      "itemDefId": "item.patch_kit",
      "count": 2,
      "zoneKey": "locker_passenger_2"
    },
    {
      "itemDefId": "item.blaster",
      "count": 3,
      "zoneKey": "arms"
    },
    {
      "itemDefId": "item.baton",
      "count": 2,
      "zoneKey": "arms"
    }
  ],
  "initialFaults": [],
  "watchBill": {
    "sections": [
      {
        "key": "red",
        "members": ["crew.noor_haddad", "crew.mara_osei", "crew.priya_kessler"]
      },
      {
        "key": "white",
        "members": ["crew.jax_okonkwo", "crew.tomas_ruiz"]
      },
      {
        "key": "blue",
        "members": ["crew.dane_whitcross", "crew.sunniva_park"]
      }
    ],
    "dayworkers": ["crew.bettina_solheim", "crew.oyelaran_abiodun"]
  }
}
